{
  "attempt_identity": "attempt-2",
  "authority_envelope_digest": "cccccccccccccccccccccccccccccccccccccccccccccccccccccccccccccccc",
  "causal_parents": [
    "evt-001",
    "evt-002"
  ],
  "effect_identity": "fs-write-394",
  "epistemic_status": "IN_DOUBT",
  "epoch": 3,
  "event_id": "evt-003",
  "evidence_refs": [
    "receipt:fs-write-394"
  ],
  "execution_identity": "rust-core-1",
  "origin": "U",
  "payload": {
    "bytes": 4096,
    "kind": "fs.write",
    "target": "docs/provenance.md"
  },
  "payload_digest": "f70a70015eccbecb55a1183d59b4860f474903b48fbfbf2c8e4a0b0415b747ee",
  "persistence_class": "REVERSIBLE",
  "program_identity": "b1-local",
  "schema_version": "b1-event-envelope-1"
}
