{
  "attempt_identity": "attempt-1",
  "causal_parents": [],
  "epistemic_status": "WORKING_ASSUMPTION",
  "epoch": 1,
  "event_id": "evt-001",
  "evidence_refs": [
    "doc:handoff#section-19"
  ],
  "execution_identity": "python-core-1",
  "origin": "U",
  "payload": {
    "kind": "plan.accepted",
    "phase": 1,
    "reversible": true
  },
  "payload_digest": "208307a28c797ee2b0b9429a1d2f9a96775e1a506e4e9d156c6bae696e0bbebe",
  "program_identity": "b1-local",
  "schema_version": "b1-event-envelope-1"
}
